Question,Exceptional,Excellent,Very Good,Good,Fair,Poor,Unacceptable
Professor's ability to present the subject matter in a clear and organized way.,4,1,4,0,0,0,0
"Professor's choice and use of course materials (including books, supplements, syllabus, electronic media).",4,1,4,0,0,0,0
Professor's relationship with students.,2,4,1,2,0,0,0
Professor's ability to stimulate student's interest in law.,2,4,3,0,0,0,0
Professor's ability to develop student's analytical skills.,2,4,3,3,0,0,0
What overall rating would you give this professor?,3,4,2,0,0,0,0
